{
  "schema_version": "1.0",
  "fixture_id": "ik-synthetic-adversarial-v0-5-0802",
  "corpus_partition": "synthetic",
  "publication": "public",
  "status": "active",
  "title": "Adversarial v0.5 fixture: unicode-stress via format-cii",
  "description": "Public synthetic fixture from the InvoiceKit adversarial-generator (T-121); scenario unicode-stress emitted through format-cii.",
  "artifact": {
    "path": "fixture.xml",
    "media_type": "application/xml",
    "sha256": "6f2a74268ce45fba687792acfa7451c204468abb4e4e5ec945414389c6e5ae99",
    "size_bytes": 5544,
    "format_family": "cii",
    "document_type": "invoice"
  },
  "jurisdiction": {
    "countries": ["DE"],
    "profile": "InvoiceKit adversarial v0.5",
    "syntax": "InvoiceKit adversarial-generator",
    "version": "0.5"
  },
  "license": {
    "license_id": "Apache-2.0",
    "copyright_holder": "InvoiceKit Authors",
    "redistribution": "public-ok"
  },
  "provenance": {
    "source_kind": "generated",
    "source_name": "InvoiceKit adversarial-generator v0.5",
    "generated_by": "invoicekit-adversarial-generator gen-corpus-v0-5",
    "generator_version": "0.5",
    "created_at": "2026-05-27T15:00:00Z"
  },
  "pii": {
    "classification": "synthetic",
    "redaction_status": "not-required",
    "contains_personal_data": false,
    "notes": "All party names, tax identifiers, tenant identifiers, and trace identifiers are fictional and generated by the adversarial harness."
  },
  "coverage": {
    "capabilities": ["serialize"],
    "scenarios": ["adversarial-unicode-stress"],
    "negative_case": false
  },
  "validation": {
    "expected_outcome": "not-yet-validated",
    "validators": [],
    "known_gaps": ["full-en16931-validation-pending"]
  },
  "maintenance": {
    "owner": "InvoiceKit Authors",
    "created_at": "2026-05-27",
    "reviewed_at": "2026-05-27",
    "review_due": "2027-05-27",
    "labels": ["adversarial", "v0-5", "synthetic"]
  }
}
