{
  "schema_version": "1.0",
  "fixture_id": "ik-synthetic-cii-d16b-0034",
  "corpus_partition": "synthetic",
  "publication": "public",
  "status": "active",
  "title": "Synthetic CII D16B credit note 0034",
  "description": "Public synthetic CII D16B fixture for Factur-X EN 16931 round-trip conformance, profile coverage, and byte-stable serializer regression.",
  "artifact": {
    "path": "fixture.xml",
    "media_type": "application/xml",
    "sha256": "75179959d7cafce1af6629ef2b7d5db62740134659bb7dd74b38a788747183cf",
    "size_bytes": 8327,
    "format_family": "cii",
    "document_type": "credit_note"
  },
  "jurisdiction": {
    "countries": [
      "ES",
      "IT"
    ],
    "profile": "Factur-X EN 16931",
    "syntax": "UN/CEFACT CII D16B CrossIndustryInvoice",
    "version": "D16B-100"
  },
  "license": {
    "license_id": "CC0-1.0",
    "copyright_holder": "InvoiceKit Authors",
    "redistribution": "public-ok"
  },
  "provenance": {
    "source_kind": "generated",
    "source_name": "InvoiceKit invoices-h4b3 synthetic CII corpus",
    "source_url": "urn:invoicekit:conformance:cii-d16b:synthetic",
    "generated_by": "crates/format-cii/examples/generate_cii_corpus.rs",
    "generator_version": "invoices-h4b3-v1",
    "created_at": "2026-05-27T10:00:00Z"
  },
  "pii": {
    "classification": "synthetic",
    "redaction_status": "not-required",
    "contains_personal_data": false,
    "notes": "All parties, identifiers, references, and addresses are fictional."
  },
  "coverage": {
    "capabilities": [
      "parse",
      "serialize",
      "validate"
    ],
    "scenarios": [
      "business-process-context",
      "buyer-reference",
      "byte-stable-serializer-output",
      "cii-d16b-cross-industry-invoice",
      "credit-note-type-code-381",
      "delivery-event",
      "format-cii-round-trip",
      "included-notes",
      "multi-line-document",
      "party-contact",
      "party-tax-registration",
      "payment-means-iban",
      "payment-reference",
      "payment-terms",
      "profile-factur-x-en16931",
      "vat-category-exempt"
    ],
    "negative_case": false
  },
  "validation": {
    "expected_outcome": "valid",
    "validators": [
      {
        "name": "invoicekit-format-cii parse-serialize-parse",
        "version": "0.0.0",
        "result": "pass"
      },
      {
        "name": "invoicekit-format-cii byte-stability",
        "version": "0.0.0",
        "result": "pass"
      }
    ],
    "known_gaps": [
      "Synthetic corpus targets current InvoiceKit CII IR coverage; full D16B schema element coverage is tracked by the CII coverage matrix."
    ]
  },
  "maintenance": {
    "owner": "InvoiceKit maintainers",
    "created_at": "2026-05-27",
    "reviewed_at": "2026-05-27",
    "review_due": "2027-05-27",
    "labels": [
      "synthetic",
      "cii",
      "d16b",
      "roundtrip"
    ]
  }
}
